{
  "$schema": "https://docs.spec-engine.dev/schema/v1/spec.json",
  "key": "QURY",
  "owner": null,
  "updated": "2026-10-23",
  "scope": "The spec query full-text retrieval command. Belongs here: FTS5 MATCH semantics; rank-ascending results; superseded exclusion; --limit bounds. Does not belong here: file-to-requirement resolution (RSLV). Boundary case: a bare AND or OR is an FTS5 grammar error and a QURY exit-2 contract.",
  "grammar": "ears",
  "requirements": [
    {
      "id": "QURY-001",
      "status": "superseded",
      "statement": "spec query answers full-text retrieval over requirement text and rationale via FTS5.",
      "why": "Rung-1 agent retrieval — a semantic-ish hit a plain grep for the id would miss.",
      "supersedes": null,
      "supersededBy": "QURY-005",
      "relates": [],
      "issues": [],
      "changedAtVersion": 1,
      "supersededAtVersion": 2,
      "aliases": [],
      "cites": []
    },
    {
      "id": "QURY-002",
      "status": "superseded",
      "statement": "spec query matches porter-stemmed forms of the search text, so querying 'renewal charge' returns a requirement whose text says 'renews'.",
      "why": "Without stemming, agents must guess the author's exact wording; the headline find-the-requirement-by-the-value-moment retrieval promise silently fails.",
      "supersedes": null,
      "supersededBy": "QURY-007",
      "relates": [],
      "issues": [],
      "changedAtVersion": 1,
      "supersededAtVersion": 3,
      "aliases": [],
      "cites": []
    },
    {
      "id": "QURY-003",
      "status": "superseded",
      "statement": "spec query returns TERM-domain glossary definitions in a Terms group beside requirement hits, discriminated by the FtsHit key so a term hit is distinguishable from a requirement hit, while terms stay excluded from the coverage matrix",
      "why": "the glossary becomes searchable at query time — the only-allowed-jargon payoff of §4.11 is visible where an author is already looking, without leaking terms into coverage obligations",
      "supersedes": null,
      "supersededBy": "QURY-008",
      "relates": [],
      "issues": [],
      "changedAtVersion": 1,
      "supersededAtVersion": 4,
      "aliases": [],
      "cites": []
    },
    {
      "id": "QURY-004",
      "status": "deprecated",
      "statement": "When searching requirements, spec query shall exclude deprecated requirements from the results.",
      "why": "Dead guidance surfacing as live sends an agent to build against a promise that no longer holds.",
      "supersedes": null,
      "supersededBy": null,
      "relates": [],
      "issues": [],
      "aliases": [],
      "cites": [],
      "deprecatedReason": "merged into QURY-010"
    },
    {
      "id": "QURY-005",
      "status": "active",
      "statement": "When given search text, spec query shall return matching requirements ranked best-match first, bounded by --limit (default 10, maximum 1000).",
      "why": "An agent acts on the top hits; unranked or unbounded output turns retrieval into scrolling, and the wrong requirement gets built against.",
      "supersedes": null,
      "supersededBy": null,
      "relates": [],
      "issues": [],
      "changedAtVersion": 1,
      "aliases": [],
      "cites": []
    },
    {
      "id": "QURY-006",
      "status": "superseded",
      "statement": "When searching requirements, spec query shall exclude superseded requirements from the results.",
      "why": "A superseded statement surfacing as live sends an agent to build against a contract that no longer holds.",
      "supersedes": null,
      "supersededBy": "QURY-010",
      "relates": [],
      "issues": [],
      "aliases": [],
      "cites": [],
      "supersededAtVersion": 6
    },
    {
      "id": "QURY-007",
      "status": "superseded",
      "statement": "When the search text and a requirement's wording differ only by word inflection, spec query shall still match — stemming makes 'renewal charge' return a requirement whose text says 'renews'.",
      "why": "Without stemming, agents must guess the author's exact wording, and retrieval silently fails on everyday inflection differences.",
      "supersedes": null,
      "supersededBy": "QURY-009",
      "relates": [],
      "issues": [],
      "changedAtVersion": 1,
      "supersededAtVersion": 5,
      "aliases": [],
      "cites": []
    },
    {
      "id": "QURY-008",
      "status": "active",
      "statement": "When a spec query match is a TERM-domain glossary definition, the spec CLI shall return it in a Terms group beside the requirement hits, discriminated by the key field so a term hit is distinguishable from a requirement hit.",
      "why": "A term hit rendered as an undistinguished requirement row reads as a coverage obligation, and the payoff of searchable jargon is lost exactly where an author is already looking.",
      "supersedes": null,
      "supersededBy": null,
      "relates": [],
      "issues": [],
      "changedAtVersion": 1,
      "aliases": [],
      "cites": []
    },
    {
      "id": "QURY-009",
      "status": "superseded",
      "statement": "When the search text and a requirement's wording differ only by word inflection, spec query shall still match — 'renewal charge' shall return a requirement whose text says 'renews'.",
      "why": "When retrieval demands the author's exact wording, everyday inflection differences silently return nothing and duplicates get minted for requirements that already exist.",
      "supersedes": null,
      "supersededBy": "QURY-011",
      "relates": [],
      "issues": [],
      "changedAtVersion": 1,
      "aliases": [],
      "cites": [],
      "supersededAtVersion": 7
    },
    {
      "id": "QURY-010",
      "status": "active",
      "statement": "When searching requirements, spec query shall exclude superseded and deprecated requirements from the results.",
      "why": "A superseded statement surfacing as live sends an agent to build against a contract that no longer holds.",
      "supersedes": null,
      "supersededBy": null,
      "relates": [],
      "issues": [],
      "aliases": [],
      "cites": []
    },
    {
      "id": "QURY-011",
      "status": "active",
      "statement": "When the search text and a requirement's wording differ only by word inflection, spec query shall return that requirement.",
      "why": "When retrieval demands the author's exact wording, everyday inflection differences silently return nothing and duplicates get minted for requirements that already exist.",
      "supersedes": null,
      "supersededBy": null,
      "relates": [],
      "issues": [],
      "aliases": [],
      "cites": []
    }
  ],
  "grammarSeverity": "error"
}
