{
  "key": "MAP",
  "owner": null,
  "updated": "2026-10-22",
  "scope": "The spec map requirement-by-repo coverage matrix. Belongs here: the matrix rows; the src, test, src+test, and dash rendering; the webapp matrix view. Does not belong here: full-text retrieval (QURY). Boundary case: MAP stays its own domain because the webapp matrix view will accrue here.",
  "grammar": "ears",
  "requirements": [
    {
      "id": "MAP-001",
      "status": "superseded",
      "statement": "spec map renders the cross-repo requirement-to-repo coverage matrix derived from tags, with per-cell src/test/src+test states.",
      "why": "The platform coverage view a single-repo scan cannot give.",
      "supersedes": null,
      "supersededBy": "MAP-002",
      "relates": [],
      "livesIn": [
        "@packages/engine/src/commands/map.ts"
      ],
      "issues": [],
      "changedAtVersion": 1,
      "supersededAtVersion": 2,
      "aliases": [],
      "cites": []
    },
    {
      "id": "MAP-002",
      "status": "active",
      "statement": "When spec map is run, the spec CLI shall render the requirement-by-member-repo coverage matrix derived from @spec tags, marking each cell as src, test, src+test, or uncovered.",
      "why": "Without the cross-repo matrix, a requirement covered in one member and silently absent in another looks done — no single-repo scan can show which member lags.",
      "supersedes": null,
      "supersededBy": null,
      "relates": [],
      "livesIn": [
        "packages/engine/src/commands/map.ts"
      ],
      "issues": [],
      "changedAtVersion": 1,
      "aliases": [],
      "cites": []
    },
    {
      "id": "MAP-003",
      "status": "active",
      "statement": "When spec get is run with a requirement id, the spec CLI shall print that requirement's full record from the derived index, or print [] on stdout with guidance on stderr and exit 0 when the id is unknown.",
      "why": "An agent that needs a requirement's statement, status, and version today has to start spec serve or grep SPEC.json; every other read has a CLI verb.",
      "supersedes": null,
      "supersededBy": null,
      "relates": [],
      "livesIn": [
        "packages/engine/src/operations/records.ts"
      ],
      "issues": [],
      "aliases": [],
      "cites": []
    },
    {
      "id": "MAP-004",
      "status": "active",
      "statement": "When spec list is run, the spec CLI shall print every requirement record in (key, seq) order, filtered to one domain by --domain and to one status by --status when given.",
      "why": "spec query excludes superseded and deprecated rows and ranks by relevance, so nothing enumerates the catalog as records, in order, including history.",
      "supersedes": null,
      "supersededBy": null,
      "relates": [],
      "livesIn": [
        "packages/engine/src/operations/records.ts"
      ],
      "issues": [],
      "aliases": [],
      "cites": []
    },
    {
      "id": "MAP-005",
      "status": "active",
      "statement": "When spec get prints a requirement, the spec CLI shall list its implementing sites and its verifying sites, each a file and line read from the code tags, sorted by repo, file, and line.",
      "why": "The code tags are the only record of where a requirement is built and proved, so a reader who cannot see them from the requirement goes back to grepping the tree.",
      "supersedes": null,
      "supersededBy": null,
      "relates": [],
      "livesIn": [],
      "issues": [],
      "aliases": [],
      "cites": []
    }
  ],
  "grammarSeverity": "error"
}
