{
  "$schema": "https://docs.spec-engine.dev/schema/v1/spec.json",
  "key": "TRK",
  "owner": null,
  "updated": "2026-10-21",
  "scope": "The @spec-engine/tracker package: the offline noop adapter and the optional read-only Linear integration that resolves an opaque issue_id to a title and URL. Belongs here: the adapter interface and noop default; the single read query; SPEC_TRACKER_TOKEN handling and the no-token short-circuit; the sidecar cache; the isolation boundary (engine internals never import the tracker, no network on the derivation path). Does not belong here: how a display surface labels expired-cache data (PROV); the provenance matrix and issue-id opacity (PROV); any write back to the tracker. Boundary case: resolving an issue id is TRK's; the opacity of that id inside the index is PROV's.",
  "grammar": "ears",
  "requirements": [
    {
      "id": "TRK-001",
      "status": "superseded",
      "statement": "The spec engine internals never import @spec-engine/tracker and emit no external-network host literal, so the derived index is built fully offline.",
      "why": "If the derivation path reached the network or the tracker, spec index and spec check could hang, leak, or vary by network state — breaking the offline-deterministic guarantee adopters depend on.",
      "supersedes": null,
      "supersededBy": "TRK-004",
      "relates": [],
      "issues": [],
      "changedAtVersion": 1,
      "supersededAtVersion": 2,
      "aliases": [],
      "cites": []
    },
    {
      "id": "TRK-002",
      "status": "superseded",
      "statement": "The tracker adapter sends only a GraphQL read query to the issue tracker — never a mutation — so requirement state is looked up but never written back (one-way truth).",
      "why": "A mutation path would let the tool modify tracker state as a side effect of a read — turning a lookup into an unaudited write and violating the one-way-truth boundary.",
      "supersedes": null,
      "supersededBy": "TRK-005",
      "relates": [],
      "issues": [],
      "changedAtVersion": 1,
      "supersededAtVersion": 3,
      "aliases": [],
      "cites": []
    },
    {
      "id": "TRK-003",
      "status": "superseded",
      "statement": "The tracker adapter reads SPEC_TRACKER_TOKEN once from the environment, sends it only as the raw Authorization header, and never writes it to a console.* call, so the credential cannot leak into logs.",
      "why": "A token written to a log line would leak a live credential into CI output or a developer's terminal scrollback — a credential-exposure incident from a debug print.",
      "supersedes": null,
      "supersededBy": "TRK-006",
      "relates": [],
      "issues": [],
      "changedAtVersion": 1,
      "supersededAtVersion": 4,
      "aliases": [],
      "cites": []
    },
    {
      "id": "TRK-004",
      "status": "active",
      "statement": "While building or checking the derived index, the spec engine shall perform no network access, so spec index and spec check produce identical results with or without connectivity.",
      "why": "If the derivation path reached the network or the tracker, spec index and spec check could hang, leak, or vary by network state — breaking the offline-deterministic guarantee adopters depend on.",
      "supersedes": null,
      "supersededBy": null,
      "relates": [],
      "issues": [],
      "changedAtVersion": 1,
      "aliases": [],
      "cites": []
    },
    {
      "id": "TRK-005",
      "status": "superseded",
      "statement": "When the tracker adapter resolves an issue id, it shall send only read requests to the issue tracker; it shall never send a mutation or otherwise modify tracker state.",
      "why": "A mutation path would let the tool modify tracker state as a side effect of a read — turning a lookup into an unaudited write and violating the one-way boundary.",
      "supersedes": null,
      "supersededBy": "TRK-007",
      "relates": [],
      "issues": [],
      "changedAtVersion": 1,
      "aliases": [],
      "cites": [],
      "supersededAtVersion": 5
    },
    {
      "id": "TRK-006",
      "status": "superseded",
      "statement": "When the tracker adapter authenticates, it shall send the SPEC_TRACKER_TOKEN value only in the Authorization header of tracker requests; the token value shall never appear in stdout, stderr, or any log output.",
      "why": "A token written to a log line would leak a live credential into CI output or a developer's terminal scrollback — a credential-exposure incident from a debug print.",
      "supersedes": null,
      "supersededBy": "TRK-008",
      "relates": [],
      "issues": [],
      "changedAtVersion": 1,
      "aliases": [],
      "cites": [],
      "supersededAtVersion": 6
    },
    {
      "id": "TRK-007",
      "status": "active",
      "statement": "When the tracker adapter resolves an issue id, it shall send only read requests to the issue tracker.",
      "why": "A mutation path would let the tool modify tracker state as a side effect of a read — turning a lookup into an unaudited write and violating the one-way boundary. Never a mutation, never any other write to tracker state.",
      "supersedes": null,
      "supersededBy": null,
      "relates": [],
      "issues": [],
      "aliases": [],
      "cites": []
    },
    {
      "id": "TRK-008",
      "status": "active",
      "statement": "When the tracker adapter authenticates, it shall send the SPEC_TRACKER_TOKEN value only in the Authorization header of tracker requests.",
      "why": "A token sent anywhere but the Authorization header (a query string, a request body) lands in proxy and tracker logs as a live credential.",
      "supersedes": null,
      "supersededBy": null,
      "relates": [],
      "issues": [],
      "aliases": [],
      "cites": []
    },
    {
      "id": "TRK-009",
      "status": "active",
      "statement": "The tracker adapter shall never write the SPEC_TRACKER_TOKEN value to stdout, stderr, or any log output.",
      "why": "A token written to a log line would leak a live credential into CI output or a developer's terminal scrollback — a credential-exposure incident from a debug print.",
      "supersedes": null,
      "supersededBy": null,
      "relates": [
        "TRK-008"
      ],
      "issues": [],
      "aliases": [],
      "cites": []
    }
  ],
  "grammarSeverity": "error"
}
