{
  "key": "PROP",
  "owner": "drea",
  "updated": "2026-10-22",
  "scope": "Propagation and migration state, including the drift definition. Belongs here: the per-repo migrated or drifted state; spec propagation; the drift definition. Does not belong here: the SPEC.json model shape (SCHM). Boundary case: the drift definition is PROP's contract; the SQL view that computes it is only enforcement.",
  "grammar": "ears",
  "requirements": [
    {
      "id": "PROP-01",
      "status": "superseded",
      "statement": "A rule change requires every bound site to re-prove green (GATE-02 applied across all tagged sites), so a partial update (cart fixed, invoice not) fails the gate.",
      "why": "Propagation has teeth — a rule change is not done until every bound site re-proves green; a partial update fails.",
      "supersedes": null,
      "supersededBy": "PROOF-006",
      "relates": [],
      "issues": [],
      "aliases": [],
      "cites": []
    },
    {
      "id": "PROP-002",
      "status": "superseded",
      "statement": "A repo is drifted only when it is pinned to a spec version older than the version in which a requirement it actually references changed; behind-but-unaffected is not drift.",
      "why": "Drift must be precise or the gate cries wolf.",
      "supersedes": null,
      "supersededBy": "PROP-004",
      "relates": [],
      "issues": [],
      "changedAtVersion": 1,
      "supersededAtVersion": 3,
      "aliases": [],
      "cites": []
    },
    {
      "id": "PROP-003",
      "status": "superseded",
      "statement": "spec propagation shows, for a superseded requirement, which repos migrated to the successor and which are still pinned behind.",
      "why": "The value moment — BILLING-009 shipped: api migrated, mobile still on BILLING-001.",
      "supersedes": null,
      "supersededBy": "PROP-005",
      "relates": [],
      "issues": [],
      "changedAtVersion": 1,
      "supersededAtVersion": 4,
      "aliases": [],
      "cites": []
    },
    {
      "id": "PROP-004",
      "status": "active",
      "statement": "The spec CLI shall report a member repo as drifted for a requirement only when the repo references that requirement with an @spec tag and the repo's pinned spec version is older than the requirement's changed_at_version.",
      "why": "If merely being behind counted as drift, every version bump would flag every member and real drift would drown in noise — a gate that cries wolf gets ignored.",
      "supersedes": null,
      "supersededBy": null,
      "relates": [],
      "issues": [],
      "changedAtVersion": 1,
      "aliases": [],
      "cites": []
    },
    {
      "id": "PROP-005",
      "status": "superseded",
      "statement": "When spec propagation <KEY-NNN> is run for a superseded requirement, the spec CLI shall report one row per member repo classifying it as migrated to the successor (verified or unverified), still on the predecessor, on another requirement of the domain, or referencing the domain not at all.",
      "why": "After a supersession ships, a member can keep building on the predecessor indefinitely; without per-repo migration state no one can see which repos are behind until the drift bites in production.",
      "supersedes": null,
      "supersededBy": "PROP-007",
      "relates": [],
      "issues": [],
      "changedAtVersion": 1,
      "aliases": [],
      "cites": [],
      "supersededAtVersion": 5
    },
    {
      "id": "PROP-006",
      "status": "active",
      "statement": "When propagation is reported for a requirement, the spec CLI and the webapp propagation page shall list the member rows in dependency order: a member after every member it depends on in the platform map's dependsOn, and members at the same depth by name.",
      "why": "A consumer can only migrate to a successor after the packages it depends on ship it; a name-ordered list hides that order and sends teams to migrate downstream members first.",
      "supersedes": null,
      "supersededBy": null,
      "relates": [],
      "issues": [],
      "aliases": [],
      "cites": []
    },
    {
      "id": "PROP-007",
      "status": "active",
      "statement": "When spec propagation runs for a superseded requirement, it shall classify each member repo as migrated to the successor, still on the predecessor, or elsewhere in the domain.",
      "why": "After a supersession ships, a member can keep building on the predecessor indefinitely; without per-repo migration state no one can see which repos are behind until the drift bites in production.",
      "supersedes": null,
      "supersededBy": null,
      "relates": [],
      "issues": [],
      "aliases": [],
      "cites": []
    }
  ],
  "grammarSeverity": "error"
}
