{
  "$schema": "https://docs.spec-engine.dev/schema/v1/spec.json",
  "key": "GATE",
  "owner": "drea",
  "updated": "2026-10-22",
  "scope": "The spec gate approval command: the decision order NOT_FOUND, DRAFT, SUPERSEDED, DEPRECATED, VERSION_PIN, PASS, with pin equality passing. Belongs here: the approval decision. Does not belong here: proof-of-passing (PROOF); loss detection (GUARD). Boundary case: an unknown repo name is a usage error (exit 2), not a gate failure, and that contract is GATE's.",
  "grammar": "ears",
  "requirements": [
    {
      "id": "GATE-01",
      "status": "superseded",
      "statement": "`spec check` ingests a JUnit XML results file (one reader, no per-runner adapter) and marks each verifying `@spec` tag PASS/FAIL by correlating test cases to tags by file + test name/line.",
      "why": "One reader, runner owns the export — the trusted-red gate must read real test outcomes, not trust presence.",
      "supersedes": null,
      "supersededBy": "PROOF-001",
      "relates": [],
      "issues": [],
      "aliases": [],
      "cites": []
    },
    {
      "id": "GATE-02",
      "status": "superseded",
      "statement": "An active requirement is PROVEN only if it has ≥1 verifying tag whose test PASSED in the latest results; absent or failing proof → gate red.",
      "why": "Presence is not proof — a requirement is only trusted when its verifying test actually passed.",
      "supersedes": null,
      "supersededBy": "PROOF-002",
      "relates": [],
      "issues": [],
      "aliases": [],
      "cites": []
    },
    {
      "id": "GATE-03",
      "status": "superseded",
      "statement": "Green-suite-hides-removal — if a requirement's implementing code and its verifying test are both removed, `check` fails (the requirement is now unproven) even though the remaining suite is green.",
      "why": "A green suite must not hide a silently deleted proof; removal makes the requirement unproven.",
      "supersedes": null,
      "supersededBy": "PROOF-003",
      "relates": [],
      "issues": [],
      "aliases": [],
      "cites": []
    },
    {
      "id": "GATE-04",
      "status": "superseded",
      "statement": "`spec check --ci` consumes results and exits non-zero if any active requirement is unproven; cold-build correctness is preserved (no trust in a warm index).",
      "why": "The CI gate must be correct from a fresh build — speed never trades away trusted-red correctness (Invariant #2).",
      "supersedes": null,
      "supersededBy": "PROOF-004",
      "relates": [],
      "issues": [],
      "aliases": [],
      "cites": []
    },
    {
      "id": "GATE-05",
      "status": "superseded",
      "statement": "No results supplied → `check` runs in presence-only mode (today's behavior) and warns that proofs are unconfirmed (enables gradual adoption).",
      "why": "Gradual adoption — presence-only mode with a PROOFS_UNCONFIRMED warning lets teams onboard before wiring results.",
      "supersedes": null,
      "supersededBy": "PROOF-005",
      "relates": [],
      "issues": [],
      "aliases": [],
      "cites": []
    },
    {
      "id": "GATE-006",
      "status": "superseded",
      "statement": "spec gate passes only when the referenced requirement is approved (Active) in the spec location and the member's pin covers its changed_at_version; failures exit 1 with a typed reason.",
      "why": "The rung-3 approval primitive — the spec merge is the approval, the PR check is the enforcement.",
      "supersedes": null,
      "supersededBy": "GATE-008",
      "relates": [],
      "issues": [],
      "changedAtVersion": 1,
      "supersededAtVersion": 7,
      "aliases": [],
      "cites": []
    },
    {
      "id": "GATE-007",
      "status": "superseded",
      "statement": "When spec gate is asked about a deprecated requirement, it shall fail with reason DEPRECATED.",
      "why": "A deprecated requirement is end-of-life with no successor; before this branch existed it fell through to the version comparison and could PASS, approving new work against a dead promise.",
      "supersedes": null,
      "supersededBy": "GATE-009",
      "relates": [],
      "issues": [],
      "supersededAtVersion": 8,
      "aliases": [],
      "cites": []
    },
    {
      "id": "GATE-008",
      "status": "active",
      "statement": "When spec gate <repo> <KEY-NNN> is run, the spec CLI shall pass (exit 0) only if the requirement's status is Active and its changed_at_version is covered by the member's pinned spec version (equality passes), and shall otherwise exit 1 with a single typed reason.",
      "why": "Without a machine-checkable approval gate, a member repo can build against a draft, superseded, deprecated, or newer-than-pinned requirement — the approval recorded by the spec merge never reaches the PR check that needed it.",
      "supersedes": null,
      "supersededBy": null,
      "relates": [],
      "issues": [],
      "changedAtVersion": 1,
      "aliases": [],
      "cites": []
    },
    {
      "id": "GATE-009",
      "status": "active",
      "statement": "When spec gate is asked about a deprecated requirement, it shall fail with reason DEPRECATED.",
      "why": "A deprecated requirement is end-of-life with no successor; a gate that falls through to the version comparison can PASS, approving new work against a dead promise.",
      "supersedes": null,
      "supersededBy": null,
      "relates": [],
      "issues": [],
      "changedAtVersion": 1,
      "aliases": [],
      "cites": []
    }
  ],
  "grammarSeverity": "error"
}
