{
  "key": "OWNER",
  "owner": null,
  "updated": "2026-10-22",
  "scope": "Approval policy: who may retire or supersede a requirement, via CODEOWNERS. Belongs here: the CODEOWNERS approval policy. Does not belong here: the loss-detection mechanism (GUARD). Boundary case: detecting that a requirement disappeared is GUARD; deciding who may approve that is OWNER.",
  "grammar": "ears",
  "requirements": [
    {
      "id": "OWNER-001",
      "status": "superseded",
      "statement": "A status flip to `superseded`/`retired` requires the domain owner's approval (CODEOWNERS on the spec path); otherwise gate red.",
      "why": "Retiring or superseding a requirement is a governance act — it needs the owner's approval, enforced via CODEOWNERS.",
      "supersedes": null,
      "supersededBy": "OWNER-002",
      "relates": [],
      "issues": [],
      "changedAtVersion": 1,
      "supersededAtVersion": 2,
      "aliases": [],
      "cites": []
    },
    {
      "id": "OWNER-002",
      "status": "superseded",
      "statement": "When a change flips a requirement's status into superseded or deprecated on a spec path with CODEOWNERS domain owners and no domain owner is in the approver set, spec check shall report UNAPPROVED_STATUS_FLIP — warning severity by default, error severity under --require-owner-approval.",
      "why": "Ending a requirement's life is a governance act; without the owner check, anyone who can edit the spec file can end a requirement and the CODEOWNERS policy is decorative.",
      "supersedes": null,
      "supersededBy": "OWNER-003",
      "relates": [],
      "issues": [],
      "changedAtVersion": 1,
      "aliases": [],
      "cites": [],
      "supersededAtVersion": 3
    },
    {
      "id": "OWNER-003",
      "status": "active",
      "statement": "When a change flips a requirement to superseded or deprecated without approval from a CODEOWNERS owner of its domain, spec check shall report UNAPPROVED_STATUS_FLIP at warning severity.",
      "why": "Ending a requirement's life is a governance act; without the owner check, anyone who can edit the spec file can end a requirement and the CODEOWNERS policy is decorative.",
      "supersedes": null,
      "supersededBy": null,
      "relates": [],
      "issues": [],
      "aliases": [],
      "cites": []
    },
    {
      "id": "OWNER-004",
      "status": "active",
      "statement": "Where --require-owner-approval is given, spec check shall report UNAPPROVED_STATUS_FLIP at error severity.",
      "why": "Without an error grade, a team that requires owner sign-off could merge a status flip no owner approved.",
      "supersedes": null,
      "supersededBy": null,
      "relates": [],
      "issues": [],
      "aliases": [],
      "cites": []
    }
  ],
  "grammarSeverity": "error"
}
