{
  "$schema": "https://docs.spec-engine.dev/schema/v1/spec.json",
  "key": "RSLV",
  "owner": null,
  "updated": "2026-10-21",
  "scope": "The spec resolve files-to-requirements command and its --req reverse query. Belongs here: file-to-requirement mapping; the --req reverse tag-site query; path-containment normalization. Does not belong here: full-text search (QURY). Boundary case: an absolute path resolving outside platformDir exits 2, never a silent empty result.",
  "grammar": "ears",
  "requirements": [
    {
      "id": "RSLV-001",
      "status": "superseded",
      "statement": "spec resolve maps file paths to the requirements tagged in them, with coverage.",
      "why": "Routes a task to its requirements (agent routing).",
      "supersedes": null,
      "supersededBy": "RSLV-003",
      "relates": [],
      "issues": [],
      "changedAtVersion": 1,
      "supersededAtVersion": 2,
      "aliases": [],
      "cites": []
    },
    {
      "id": "RSLV-002",
      "status": "superseded",
      "statement": "spec resolve --json emits byte-identical output across consecutive invocations on an unchanged tree (deterministic ordering).",
      "why": "Non-deterministic output would break diff/snapshot consumers and the CI gates that compare it.",
      "supersedes": null,
      "supersededBy": "RSLV-004",
      "relates": [],
      "issues": [],
      "changedAtVersion": 1,
      "supersededAtVersion": 3,
      "aliases": [],
      "cites": []
    },
    {
      "id": "RSLV-003",
      "status": "superseded",
      "statement": "When given one or more file paths, spec resolve shall list each requirement tagged in those files; a file with no tags contributes nothing, and an empty result exits 0.",
      "why": "Routing a task by file must load the requirements that govern it; without this mapping an agent edits governed code blind.",
      "supersedes": null,
      "supersededBy": "RSLV-005",
      "relates": [],
      "issues": [],
      "changedAtVersion": 1,
      "aliases": [],
      "cites": [],
      "supersededAtVersion": 4
    },
    {
      "id": "RSLV-004",
      "status": "active",
      "statement": "The spec resolve --json output shall be byte-identical across consecutive invocations on an unchanged tree.",
      "why": "Non-deterministic output would break diff/snapshot consumers and the CI gates that compare it.",
      "supersedes": null,
      "supersededBy": null,
      "relates": [],
      "issues": [],
      "changedAtVersion": 1,
      "aliases": [],
      "cites": []
    },
    {
      "id": "RSLV-005",
      "status": "active",
      "statement": "When given one or more file paths, spec resolve shall list each requirement tagged in those files.",
      "why": "Routing a task by file must load the requirements that govern it; without this mapping an agent edits governed code blind.",
      "supersedes": null,
      "supersededBy": null,
      "relates": [],
      "issues": [],
      "aliases": [],
      "cites": []
    },
    {
      "id": "RSLV-006",
      "status": "active",
      "statement": "When none of the given files carries a @spec tag, spec resolve shall print an empty result and exit 0.",
      "why": "An untagged file is a normal answer, not a failure; an error exit would make every agent routing by file treat ungoverned code as a broken tool.",
      "supersedes": null,
      "supersededBy": null,
      "relates": [
        "RSLV-005"
      ],
      "issues": [],
      "aliases": [],
      "cites": []
    }
  ],
  "grammarSeverity": "error"
}
